"Turns out, hot dogs are the great unifier. I figured this out at our first annual Organic Apple Festival four years ago when I spent the day serving up grilled organic hot dogs that even the old Dutchie men gave the thumbs-up. It's hard to find people who don't like",|
Want to add some fab eco-friendly style to your home but have no time to page through thousands of eBay listings? Then just sneak a peek at my Weekly eBay Roundup of Vintage Home Finds. This eclectic mix of designer and non-designer vintage home finds caught my discerning eye because,|
"Recently, I had what Oprah calls an ""aha moment."" I'm no die-hard Oprah fan, but her term was a perfect description for something that happened earlier this week. It all began when I picked up my oldest son from school. I had just exercised and was still wearing my Nike",|
"It's called funny money, but Leann Ward isn't laughing. She received a fake $100 bill from a Walmart in Alpine Township, Mich., and the store refused to replace it, according to reports. Now Ward is out the entire amount, just a month after Ward, her fiance and her 14-year-old son",|
"Posting your first kiss and details of your romantic life on social media sites is no longer considered exploitative. It's actually expected. But where do you draw the line between kiss-and-tell and kiss-and-post? With marriage proposals appearing on Twitter and couples breaking up on Facebook, it can be confusing for",|
"Key West is an island in two worlds. There is the Key West seen by the thousands of visitors each week, mostly cruise passengers, who spend the afternoon wandering among the noisy bars of Duval Street before they buy a t-shirt and return to the ship. Then there is the",|
"File photo date 01/07/08 of an Apple iPhone as three-quarters of parents with smartphones share apps with their children and more than a third consider them to be an 'integral' part of family life, according to a study. When it comes to personal banking, the smartphone can now accomplish most",|
"The new Apple iPhone 5 is displayed Wednesday Sept. 12, 2012 following the introduction of new products in San Francisco. The iPhone 5 is a blend of beauty, utility and versatility. (AP Photo/Eric Risberg) You're between flights and between meals when your stomach (or children) begins to grumble. Or perhaps",|
"In 2007, Chris Williams's pregnant wife and two of his four children were killed in a car accident that was caused by a drunk driver. In this inspiring AOL video, Williams, now the author of “Let It Go: A True Story of Tragedy and Forgiveness,” discusses the emotional aftermath of",|
"Think Tyrannosaurus rex was the ultimate predator? Think again. Carcharocles megalodon, a.k.a. Megalodon, was ""probably the apex predator of all time,"" according to paleontologist Chuck Ciampaglio. The Wright State University professor spoke to the Discovery Channel recently about Megalodon, a long-extinct prehistoric shark whose name literally translates as ""big tooth.""",|
"So the flip-flops are put away, the digital snaps are posted to Facebook, and you've had maybe a few weeks back at the office. Are you still feeling the restorative effects of your holiday? I've always found this time of year a bit overwhelming, especially these first days back at",|
"Cameron Winklevoss, left, and his brother, Tyler, stand for a portrait after a television interview in New York, U.S., on Thursday, Oct. 7, 2010. The twin brothers resolved litigation with Facebook Inc. over the creation of the social-networking site in 2008, but have subsequently contested the settlement, claiming they were",|
"This list of the top 10 college games of the fall 2012 season uses the average price of tickets on the resale market. “Resale market” means tickets for sale on major websites like StubHub, Ticket Network and eBay. The list is determined using numbers from TiqIQ ,an event ticket price",|
"This June 1, 2012 file photo shows Grammy Award winning hip hop artist Lil Wayne, left, and professional skateboarder Stevie Williams celebrating at the launch of their contemporary clothing lines TRUKFIT and DGK at Macys stores in Los Angeles. (Photo by Katy Winn/Invision, file) Another week, another batch of critics",|
"Technology giant Apple has unveiled a raft of updated products including the latest model of its new iPhone. The iPhone 5, which weighs in at 112 grammes, has a 4in screen - half an inch bigger than previous models, at Kings Place, Central London. The tablet wars are heating up.",|
"A jury recently ordered Samsung to pay Apple over $1 billion for violating smartphone patents for the iPhone and iPad. Given the high-profile nature of the case and the two companies' ongoing patent battles around the world, you'd think other tech companies would try to make their products look as",|
"Toddler-speak works well on Twitter. Short declarative bursts of nonsense. Questions that border on absurd. Crankiness. While some fictional little personas, like @HonestToddler and irisgrim, make excellent use of the medium to spread their bedtime-defying, unbroken-cracker-loving gospel, Leslie McCollom's feed, @PreschoolGems, is special because her quotes come from whole classes",|
"Here's a fun Autumn treat you can easily whip up with a bunch of fresh apples. I have a sugar-free version of Gluten-Free Apple Orange Pistachio Crisp here. Gluten-Free Apple Lime Crisp Ingredients 2 Tbsp. honey 3 Tbsp. butter 1 tsp. cinnamon 1 Tbsp. lime zest 3 Granny Smith apples,",|
"I once heard someone say, ""It's easy to stay married, just don't get a divorce."" What kind of advice is that? The last time I was legally uncommitted, the Gores were still making out. There were no iPhones or Facebook, a good date was nachos and a dollar pitcher of",|
"My two passions in life happen to coincide for one week every year as the US Open plays out in Queens and the new spring season plays out in Lincoln Center. And this particular September, it practically felt indistinguishable. Not only have tennis pros Serena Williams and Maria Sharapova brought",|
"If anyone thought Lady Gaga would settle into a complacent hair groove after going ""Louis Vuitton brown"" last month , the singer made sure to show us that she still has a few hair tricks up her sleeve. The 26-year-old took to Twitter, her news-revealing medium of choice these days,",|
"Anyone who grew up in the 1990s knows just how good kids had it back then: legit Saturday morning cartoons, pogs, L.A. Lights, Oregon Trail for the Apple II, and of course, the raddest snack foods known to mankind. Containing enough sugar to power a small city and colors not",|
Want to add some fab eco-friendly style to your home but have no time to page through thousands of eBay listings? Then just sneak a peek at my Weekly eBay Roundup of Vintage Home Finds. This eclectic mix of designer and non-designer vintage home finds caught my discerning eye because,|
"Just as Facebook allows us to customize our own profile pages, the company encourages its employees to make their surroundings their own. Our friends at California Home + Design gave us an inside look at the creative Menlo Park, California offices designed by international architecture firm, Gensler, lead by Randy",|
"(Reuters) - Amazon.com, in an apparent switch in its pricing policy, said over the weekend that it will allow purchasers of its new Kindle Fire tablets to pay $15 extra to turn off advertisements that are built into the devices. The change came barely a day after Amazon on Thursday",|
"1 / 9 The iPhone 5 Will Finally -- FINALLY! -- Be Here On Wednesday Before we get started on this super-sized edition of <strong>This Week In Apple Rumors</strong>, I'd just like to say that this is, personally, a bittersweet column for me to write. You see, for about 14",|
"Unfortunately your browser does not support IFrames. Clint Eastwood's ""unorthodox"" speech at the Republican National Convention, in which he addressed an empty chair as President Barack Obama, was mocked by various celebrities and even inspired an @InvisibleObama Twitter account. ""He humiliated himself,"" Star Jones tweeted about the ""Dirty Harry"" actor.",|
"Jeff Bezos, CEO and founder of Amazon, holds the Kindle Paperwhite at the introduction of the new Amazon Kindle Fire HD and Paperwhite devices in Santa Monica, Calif., Thursday, Sept. 6, 2012. (AP Photo/Reed Saxon) By Alistair Barr and Sinead Carew (Reuters) - Amazon.com Inc trumpeted cutting-edge wireless technology as",|
"Back in May, Rian Johnson -- who's currently at the Toronto International Film Festival promoting ""Looper,"" a movie that he wrote and directed -- participated in a tribute we published on the 35th anniversary of ""Star Wars."" On that day, Johnson took to Twitter to rail against the absurdity that",|
"I live here in Charlotte. And after this week in Charlotte, I'm solidly convinced I now know what it must feel like to live in Los Angeles. My Jetta sandwiched between polished limos or black Suburbans. Facebook statuses echoing news that a specific celebrity is spinning tunes late at night.",|
"I'm a few calendar pages past the start of the third trimester, and I've heard it countless times: ""When will you be posting a photo of your bump on Facebook?!"" As much as I hate to disappoint remote family and friends, you won't catch me posting any weekly arms-length, head-cut-off,",|
"My wife and I are hitting that age where everyone around us seems to be experiencing some version of a midlife crisis. A few marriages have ended, some are floundering, and others are just drifting along in a coma-like stasis of school runs and Facebook statuses and working later and",|
"No time to page through thousands of eBay listings? Then just sneak a peek at my weekly eBay roundup of top vintage clothing finds. This eclectic mix of designer and non-designer vintage clothing and accessories caught my discerning eye because of its uniqueness, contemporary feel and highly collectible nature. As",|
"Kristin Shaw is an Elkhart native turned Austin-based aviation industry marketer. A graduate of University of Cincinnati, Kristin loves her family, airports, classic cars, sports, Italy and dessert; not necessarily in that order. She blogs at Two Cannoli and keeps the world abreast of her whereabouts through her Twitter. Her",|
"If your kid could tell you what he thought of his summer break, what would he say? Here's what mine had to say... It's the day after Labor Day. I'm cruising Facebook. There's one picture after another of kids going back to school in still store-creased polo shirts hauling backpacks",|
"Some women use social media to plan their weddings. Turkish bride Candan Canik used social media to tie the knot. Canik and her husband, Cengizhan Çelik, a social media editor, used Twitter to exchange their vows on Monday, becoming the first Turkish couple to do so, according to World Bulletin,",|
"Key fobs are magical things. On many car models, the electric remotes that lock and unlock the doors and trunk come standard, but a convenient feature of the key remote has long gone unused by many car owners. The remotes can often lower a car's windows, allowing owners to start",|
Want to add some fab eco-friendly style to your home but have no time to page through thousands of eBay listings? Then just sneak a peek at my Weekly eBay Roundup of Vintage Home Finds. This eclectic mix of designer and non-designer vintage home finds caught my discerning eye because,|
"Yesterday I was reading something from a fellow blogger about how he always buys solid-colored shirts at Target. His wife had posted a picture of him on Facebook, and it makes me laugh to tag pictures with ridiculous tags, so I tagged his pic. He was holding a piece of",|
"How far would you go to protect your child? For Jesper and Julie Myrfors of Sedro-Wooley, Wash., keeping their teenage daughter out of harm's way meant participating in an elaborate Facebook hoax, one that Jezebel characterizes as ""creepy."" Their goal: to keep the 15-year-old from dating a registered sex offender.",|
"* Treats leukemia with Philadelphia chromosome mutation * Drug given orphan status WASHINGTON, Sept 4 (Reuters) - U.S. health regulators on Tuesday approved a Pfizer Inc pill for a rare type of leukemia, another step in the company's effort to expand its oncology business. The medicine, called Bosulif, treats chronic",|
"1 / 6 Apple To Release EIGHT New Products By Year's End: Analyst The iPhone 5. The iPad Mini. A modified iPad. A 13-inch MacBook Pro with Retina Display. A new iPod Touch. A new iPod Nano. Two new iMacs. These are the eight new Apple products, to be unveiled",|
"ADDITION FOR CLARIFICATION ON WHERE RULING WAS MADE - FILE - This photo illustration made July 24, 2012 shows the Apple Inc. logo reflected on a Samsung notebook computer in Duesseldorf, Germany. After a year of scorched-earth litigation, a jury in San Jose, Calif., decided Friday, Aug. 24, 2012 that",|
"What makes it more likely that an overweight or obese 5th grader won't remain obese by the 8th grade? Location, location, location! A recent study in the Archive of Pediatric and Adolescent Medicine by Bridging the Gap shows that an overweight or obese 5th grader who lives in a state",|
"Recently I got a message from a student asking what techniques I would suggest for helping people limit their time on Facebook. Specifically, this student requested suggestions for NLP (neuro-linguistic programming) techniques that could help. I have to admit, when it first came along, I wasn't a big fan of",|
"A while back on Facebook, my friend Sharon Hyman -- of Neverbloomers fame -- posted the following status update: ""If you could go back and Etch-a-Sketch away some part of your life, what would it be?"" Wow. What a great question. I've always believed that regret is a central component",|
"No time to page through thousands of eBay listings? Then just sneak a peek at my weekly eBay roundup of top vintage clothing finds. This eclectic mix of designer and non-designer vintage clothing and accessories caught my discerning eye because of its uniqueness, contemporary feel and highly collectible nature. As",|
Want to add some fab eco-friendly style to your home but have no time to page through thousands of eBay listings? Then just sneak a peek at my Weekly eBay Roundup of Vintage Home Finds. This eclectic mix of designer and non-designer vintage home finds caught my discerning eye because,|
"Last week we took a look back at some of our favorite quotes about aging with style. This week, we've rounded up some words of wisdom from Cindy Crawford, Carmen Electra and more, on the all-important topic of swimsuits. Not surprisingly, bathing beauties Ursula Andress and Esther Williams had something",|
"I used to spend hours in the woods selecting and cutting hundreds of small trees, which I carved into walking sticks that I sold at craft shows and flea markets. Apple picker, landscaper and lumberman are also part of my income history, along with several other outdoor jobs and businesses.",|
"WHO: ""My Week with Marilyn"" star Michelle Williams WHAT: Jason Segel's gal hit the playground in style as she watched her daughter Matilda enjoy an afternoon at the park. Matilda's mama paired a casual black tank with comfy, printed pants. The Oscar-nominated actress was ready for the sun with a",|
"Recently, I came across a link to this article titled ""Child-free flight: You'd be plane crazy not to pay for that,"" posted by someone on Twitter. The piece published on news.com.au talks about how according to a survey by TripAdvisor UK, almost one third of plane passengers are willing to",|
"WHO: Pro tennis player Serena Williams WHERE: The tennis legend was seen making her way onto the ""The Late Show With David Letterman"" on August 21st. Click here to see Serena William's style evolution. Pacific Coast News Shop a similar look below, and check out more of our Look Of",|
"This week I celebrated a very important anniversary. Just three years ago I fell in serious ""like"" at the Apple store with a special guy whom I now fondly refer to as the ""Apple Guy."" As one who writes about the intersection of love and technology, I've written several articles",|
"To revive her stripper role in the upcoming ""Sin City: A Dame To Kill For,"" Jessica had to go back to blonde. Lucky for us, the 31-year-old actress took to Twitter to document the annoyingly lengthy process of going ombre (believe us, we've been through it). ""Bye bye brown hair,""",|
"Like the rest of the world, we spend a lot of time on Twitter . A lot. It's not only how we get our news and procrastinate, but it provides so much entertainment with so few characters. It's also the best way to get a behind-the-scenes look at all of",|
"Like the rest of the world, we spend a lot of time on Twitter . A lot. It's not only how we get our news and procrastinate, but it provides so much entertainment with so few characters. It's also the best way to get a behind-the-scenes look at all of",|
"To revive her stripper role in the upcoming ""Sin City: A Dame To Kill For,"" Jessica had to go back to blonde. Lucky for us, the 31-year-old actress took to Twitter to document the annoyingly lengthy process of going ombre (believe us, we've been through it). ""Bye bye brown hair,""",|
"1 / 4 The iPhone 5 Will Be Released In September, The iPad Mini In October: Reports The <a href=""http://allthingsd.com/20120825/confirmed-new-ipad-mini-will-debut-in-october-after-latest-iphones-september-bow/"" target=""_hplink"">big rumor this week</a> is that Apple is holding two separate events this autumn, one for the next iPhone in September and then another for the iPad Mini in October.",|
"Microsoft CEO Steve Ballmer speaks at the Web. 2.0 Summit in San Francisco, Tuesday, Oct. 18, 2011. Ballmer spoke about Microsoft, Yahoo, Apple and Google during his talk. (AP Photo/Paul Sakuma) By Lee Chyen Yee and Bill Rigby HONG KONG/SEATTLE (Reuters) - Apple Inc's decisive triumph over Samsung Electronics in",|
"Every week day at 4 p.m. EST, we here at HuffPost Entertainment ask our followers on Twitter (@HuffPostEnt) if they can identify a film based on a single, 140-characters-or-less quote. Whoever can do so the fastest is our daily winner. (Of course, we're operating on an honor system here --",|
"FILE - In this July 7, 2010 file picture a man walks past near the logos of the Samsung Electronics at its show room in Seoul, South Korea. A Duesseldorf, Germany, court has issued a split decision in a patent dispute between rivals Apple and Samsung over two of the",|
"SAN FRANCISCO (Reuters) - Samsung Electronics called a U.S. jury decision in favor of Apple Inc ""a loss for the American consumer"" because it would stifle innovation and push up prices. Apple scored a sweeping legal victory over its arch-rival as a U.S. jury on Friday found the Korean company",|
"Target is now cheaper than Walmart. According to study conducted by Bloomberg, Target's prices were cheaper than Walmart's by 0.46 percentage points in August, meaning that $100 worth of goods at Walmart cost $0.46 less at Target. The study is based on a monthly comparison between the prices of 150",|
"Fresh from the Olympics, Serena Williams is gearing up for the U.S. Open, but that doesn't mean she isn't taking a little time off the court to get gussied up for a chat with David Letterman. The tennis superstar was spotted outside of Letterman's ""Late Show"" wearing a skintight red",|
"Earlier this week Britney Spears lamented the end of summer by posting a photo of herself looking amazing in a white bikini, but according to Us Weekly, that photo is really old. ""Y'all ready for summer to end? I'm definitely not,"" the 30-year-old singer wrote on her Facebook page, posting",|
"tweeps, pl. n.: a person’s followers on the social networking site Twitter (As in, ""Good night, tweeps! Love you all xx"") totes, adv.: totally (As in, ""Girl, that bag is totes amaze. Where did you get it?"") ridic, adj.: ridiculous (abbrev.) (As in, ""Have you seen Paul Ryan's shirtless pic?",|
