"Breastfeeding caused a media blitz in 2012. Protests over the removal of certain pictures of women breastfeeding caused a clarification of Facebook policy in February. In March, Beyoncé breastfed baby Blue Ivy in public. In April, Miranda Kerr posted pictures of her breastfeeding baby Flynn on her Twitter account. In",|
"baby with touch pad at home Picture this: You're gathered at the dinner table with your family, and the mood is light and relaxed. No one is in a hurry to leave, rush off to check email, or update a Facebook status. After having been fed by the meal itself,",|
"Title: ""Allergic To Facebook"" Author: Victoria Age: 7 Assignment: ""The teacher had the kids create their 'memory books' for the end of the school year,"" mom writes. Standard student responses included: ""I love pizza."" Recent study Victoria's drawing could be used to illustrate: This one. Other ""allergies"" dad might one",|
"It was rumored that actress Reese Witherspoon had snatched her son Deacon's cargo jacket out of his closet so she could wear it herself. Rumor or not, I can understand her inclination: The olive green jackets are everywhere these days. So when I spotted a Gap Kids version of the",|
Want to add some fab eco-friendly style to your home but have no time to page through thousands of eBay listings? Then just sneak a peek at my Weekly eBay Roundup of Vintage Home Finds. This eclectic mix of designer and non-designer vintage home finds caught my discerning eye because,|
"Weddings are wonderful, but let's be honest: planning one can leave even the most blissful bride feeling stressed out and overwhelmed. With that in mind, we asked our Twitter followers to share how they cope with Big Day anxiety. Click through the slideshow below to see how they beat pre-wedding",|
"Twitter is a funny place--trending topics on the social media site can range from the mundane to the topical to the truly bizarre and offensive. But a fairly wonderful thing manifested itself yesterday on the Interwebs. Twitter users by the thousands hijacked the inane, anti-gay (not to mention often unintelligible)",|
"1 / 4 The iPad Mini Will Be Unveiled on October 23 Once again, months and months of anticipation are coming to an end on Tuesday: No, I'm not talking about <a href=""http://en.wikipedia.org/wiki/October_23"">Weird Al Yankovic's 53rd birthday</a>, but rather the Apple event scheduled for that afternoon, at which Tim Cook",|
"The Facebook logo is displayed outside of Facebook's new headquarters in Menlo Park, Calif., Thursday, Jan. 12, 2012. Whats good for Facebook and its employees could be very good for Californias treasury. If Facebook goes public this year, as many have speculated, the state stands to reap hundreds of millions",|
"Hello Kitty leads a very full life -- as far as animated characters go. She's got a Google page and a Facebook page. She's even running for President. She makes millions of little girls happy, and we've got no qualms with this. But when we start seeing Hello Kitty sushi,",|
"Want to stay up to date on the latest health research? Twitter is a source of more information than anyone can possibly digest, but it's also the place to get up close and personal with top experts in every field. So who should you follow to learn the most about",|
"Have a nitpick-y mother-in-law or a controlling father-in-law? It's best to keep your feelings about them to yourself during marriage. But after divorce? You're finally free to rant all you want. With that in mind, we asked our followers on Facebook and Twitter to reveal the worst thing about their",|
"Some moms and daughters bond over power-walking, others by watching certain beloved TV shows. (This author bonds with her mother by jointly stalking people on Facebook.) Then there are mother-daughter pairs who undergo plastic surgery together, using the experience to bolster one another and come out feeling great at the",|
Want to add some fab eco-friendly style to your home but have no time to page through thousands of eBay listings? Then just sneak a peek at my Weekly eBay Roundup of Vintage Home Finds. This eclectic mix of designer and non-designer vintage home finds caught my discerning eye because,|
It's apple picking time! Apple picking with the kids is one of my favorite fall activities. Dealing with mountains of picked apples - not so much. Over the past few years we've come up with several ways to deal with apples so that they don't go to waste. Here are,|
"“Welcome, foolish mortals, to the Haunted Mansion. I am your host – your ‘ghost host.’"" Imagine being able to take on that role? Well, now you can because a 10,000-square foot replica of Disney’s Haunted Mansion is for sale -- to live in. Listed on eBay by Theme Park Connection",|
Domestic equities confounded anyone worried about a possible repeat of August 2011 and reached year-to-date highs in mid-September. The Dow hit a level not seen since December 2007. The questions many are asking are: Why in the world are stocks going up? Doesn't the market realize we're facing an election,|
"Today in Potentially Racist Clothing Disasters: Gap has pulled a shirt reading ""Manifest Destiny"" from its shelves after a flood of complaints and a fiery petition called for its removal. The retailer finally yanked the black and white tee, part of a collaboration with GQ magazine, after consumers sent tweets,",|
"They say hindsight is 20-20, and as anyone who's ever been through a divorce will tell you, the saying is especially true after a split. With that in mind, we asked our followers on Facebook and Twitter to tell us what post-split wisdom they wish they could pass on to",|
"I'm one of the masses who just purchased the iPhone 5. Yes, I might be a lemming who drinks the Apple Kool-Aid, but I actually did have good reason: My iPhone 4 had a cracked screen and the camera was so damaged that my photos (often used to snap pictures",|
"Studies are now showing what many of you may have suspected: We are living in an increasingly narcissistic society. In a world where prime-time television is dominated by a ""reality"" as false as the Kardashians' lashes, and people sit across dinner tables checking in on Facebook rather than having face-to-face",|
"But despite her status as a self-professed ""geriatric starlet,"" there is one very modern trend that she has yet to master: social media. She doesn't go on Facebook or Twitter (which makes us wonder who we've been following all this time) and says ""I swear on everything holy I do",|
"The Food Network's annual New York City Wine & Food Festival kicks off tomorrow, bringing in scores of foodies from the world over. And perhaps you're one of those planning to take a bite out of the Big Apple this weekend. You know the food will be fantastic, but if",|
"This photograph was posted on Red Bull Stratos' Facebook page with the caption ""Felix has landed safely from his jump from the Stratosphere"" shortly after the skydiver touched down: It wasn't immediately clear whether Baumgartner had exceeded the speed of sound during his free-fall, which had been one of the",|
"AUCKLAND, NEW ZEALAND - SEPTEMBER 28: The new iPhone 5 is launched on September 27, 2012 in Auckland, New Zealand. Telecom, with help of rugby great Jonah Lomu, launched the much-anticipated Apple iPhone 5 last night in Auckland. Jonah was joined by Opshop frontman and New Zealand's Got Talent judge,",|
"1 / 4 There Will Very Probably Be An Apple Event On October 23 ...and that event will very probably be headlined by a smaller iPad, the device that you and I and Uncle Jerry all know as the iPad Mini. Yes, it appears the Apple PR machine has leaked",|
"Keegan-Michael Key and Jordan Peele have been stars in the improv and sketch communities for a while now, but America finally caught up when they were given their own Comedy Central show, ""Key & Peele."" No small part of that success was due to their parody of Barack Obama: Having",|
"Walmart launched a large-scale response this week to a series of unprecedented labor strikes, according to a confidential document obtained by The Huffington Post. The seven-page internal memo, issued Oct. 8, is intended for salaried employees only, and contains instructions on how to respond to strikes by hourly workers that",|
"AUCKLAND, NEW ZEALAND - SEPTEMBER 28: The new iPhone 5 is launched on September 27, 2012 in Auckland, New Zealand. Telecom, with help of rugby great Jonah Lomu, launched the much-anticipated Apple iPhone 5 last night in Auckland. Jonah was joined by Opshop frontman and New Zealand's Got Talent judge,",|
"CHICAGO (Reuters) - Owners of Amazon.com's Kindle e-readers will receive refunds on past e-book purchases and see e-book prices drop if a judge approves legal settlements with publishers accused of fixing prices, according to the Internet retailer. Amazon told Kindle owners in emails on Saturday that they could receive a",|
"wedding rings exchange Yesterday I registered my 18-year-old son Nate to vote. Nate has autism. Nate and voting were two words I never thought I'd use in the same sentence -- until I got a call from his school, The Center for Discovery. It is a school that is the",|
"As Walmart workers across the country participate in the company’s first-ever retail worker strike, one former employee’s dispute with the big box store comes to a close. Meredith Boucher, a former Walmart assistant manager in Canada, was awarded $1.49 million after suing for mistreatment in the workplace, the Calgary Herald",|
"We know social media has come in handy sometimes in terms of our personal safety, but did you know in some cases sites like Facebook, Twitter and Foursquare can also put you and your home at risk for theft and intrusions? A simple status update about your upcoming vacation or",|
"As we were waking up in the serene light of dawn this morning, we switched on our laptops and did a double take at some photos we saw already making the rounds on Twitter. Was that... vice presidential candidate Paul Ryan? Wearing a backwards baseball cap? Pumping some super sweet",|
"""One does not become enlightened by imagining figures of light, but by making the darkness conscious."" -- Carl Jung Recently, on Facebook, I shared a link to an article that appeared on my news feed: ""Why I Don't Say Namaste,"" published in the Elephant Journal, an online magazine devoted to",|
"Those nerdy kids in high school were right all along. Not only do they now have the coolest jobs at companies like Google and Facebook, they were also spot on when it came to style. Spectacles? All the cool kids wear them now. Bow ties and saddle shoes? Street style",|
"Like many Etsy users, we woke up to an email from the website this morning revealing updates to its privacy policy and security settings. And there are some major changes. Users will now be able to find and be found by Facebook friends on Etsy. But more importantly, the website",|
Want to add some fab eco-friendly style to your home but have no time to page through thousands of eBay listings? Then just sneak a peek at my Weekly eBay Roundup of Vintage Home Finds. This eclectic mix of designer and non-designer vintage home finds caught my discerning eye because,|
"Texas-raised musician St. Vincent might be out touring Love This Giant, her latest collaborative album with David Byrne, but she's also Tweeting about food. What we learned while reading (er, stalking) her Twitter feed is that, even though she might not be as into food as Jason Segel clearly is,",|
"FILE - This Aug. 30, 2009 file photo shows Big Bird, of the children's television show Sesame Street, in Los Angeles. Big Bird is endangered. Jim Lehrer lost control. And Mitt Romney crushed President Barack Obama. Those were the judgments rendered across Twitter and Facebook Wednesday during the first debate",|
"1 / 4 Are Apple's iPad Mini Event Invites Going Out On Wednesday? Welcome back to Apple Rumors, folks, where we're always adjusted to the altitude and the Infield Fly Rule is only called in the infield. It's been an iPad Mini kind of week, with rumors of the iPad",|
"1 / 15 Joshua Jackson, Michelle Williams & Katie Holmes On ""Don't Trust The B---- In Apartment 23"" While we're very excited to see Busy Philipps and James Van Der Beek back together on the ABC comedy, a ""Dawson's Creek"" reunion is just not the same with the rest of",|
"File photo dated 17/01/08 of the Facebook icon displayed on a laptop, as Facebook now has one billion users, the equivalent of about one in seven of the world's population, its founder announced today. ...And promptly goes out of business. I've crudely plotted Facebook's user growth in an old notebook,",|
"Christina Aguilera took to Twitter yesterday to share the cover art for her new album, Lotus. And let's just say, she pretty much shares everything. On the cover, Aguilera is nude, with her long blonde locks draping over her chest while special effects disguise her bottom-half. It appears she's emerging",|
"So you want to be famous (Don't we all?). What good are health, happiness, and friends if you're not followed by crowds of paparazzi tracking your every move like a walking, talking Facebook status update? So you decide to go into business selling gimmick drawings of teen heartthrobs on unicorns",|
"bride and groom holding hands during ring exchange part of an outdoor wedding ceremony Do you take this man as your lawfully wedded husband? And do you promise to never flirt online or friend that cute coworker on Facebook? Huh? It may sound strange, but a new survey says that",|
"doctor give injection to... Oct 4 (Reuters) - Pfizer Inc said a late-stage trial of its vaccine to protect against pneumococcal bacteria suggested it would also work in adults aged 18-49, thereby possibly expanding its sales. The vaccine, Prevnar 13, which already has $3.5 billion in annual sales from it",|
"MIAMI - NOVEMBER 25: People stand in front of a Walmart store before the doors open at 5am on the day known as 'Black Friday' November 25, 2005 in Miami, Florida. The day after Thanksgiving traditionally kicks off the Christmas shopping season in the U.S. (Photo by Carlo Allegri/Getty Images)",|
"Wednesday marks the one-year anniversary of the launch of HuffPost Weddings -- and we couldn't be prouder! We celebrated with cupcakes in the office and reminisced about how far we've come. Now, we want to know how you celebrated your first wedding anniversaries. Below, some of our Twitter followers share",|
"The fashion resale market is becoming an important space. With fast fashion rapidly pushing trends, ""out with the old and in with the new"" has never been a more relevant statement. While eBay and Craigslist have dominated the marketplace for exchanging consumer goods, many companies have recognized the large opportunity",|
"No time to page through thousands of eBay listings? Then just sneak a peek at my weekly eBay roundup of top vintage clothing finds. This eclectic mix of designer and non-designer vintage clothing and accessories caught my discerning eye because of its uniqueness, contemporary feel and highly collectible nature. As",|
Want to add some fab eco-friendly style to your home but have no time to page through thousands of eBay listings? Then just sneak a peek at my Weekly eBay Roundup of Vintage Home Finds. This eclectic mix of designer and non-designer vintage home finds caught my discerning eye because,|
"Yesterday's post, the last of thirty-one installments of Donna's Cancer Story, was titled ""The End,"" but when I shared it on Facebook, I wrote, ""The End is not the ending."" =The End was the end of Donna's Cancer Story, but, clearly, not the end of Donna's story, because here you",|
"While this may not be the strangest grounds for divorce we've ever heard, it's certainly a bit unusual. We asked our followers on Facebook and Twitter to weigh in on whether or not watching porn is reason enough to split. Click though the slideshow below to see what they had",|
"With its new Kindle, the suitably named Paperwhite, Amazon has joined Barnes & Noble and Kobo in releasing a reader with a screen that can glow in the dark. Good thing, too: If you are in the market for an e-reader like the Kindle or Nook, and you can afford",|
"I certainly understand why Huffington Post blogger Soraya Chemaly wants Facebook to take down the page entitled ""Boobs breasts and boys who love em,"" and of course there are many reasonable people who feel that Google (which owns YouTube) should remove that horrible anti-Muslim video that has been associated with",|
"According to Twitter, there are many ways to tell if you've finally fallen or not. #YouKnowYoureInLoveWhen was trending across the U.S. Friday as tweeters told the world about the moment they knew it was more than a crush. Click through the slideshow below to see the tweets and then weigh",|
"Written by Jacqueline Burt on CafeMom's blog, The Stir. Apple season is officially here! The taste of crisp, juicy apples is the definition of fall, at least to me -- along with the feel of soft sweaters and the sound of leaves crunching under my feet. Autumn means going on",|
"Kate Middleton has another scandal on her hands. The Duke and Duchess of Cambridge might be a little embarrassed after they accidentally wore traditional garb from the Cook Islands to an official Solomon Islands dinner during her and William's recent royal tour through Asia. Before the couple's arrival, Clarence House",|
"Putting together a quick nutritious meal is easy when your cabinets are stocked with healthy staples. That’s why we took to HuffPost Healthy Living's Facebook page to ask: what is the one healthy ingredient you always keep around? With so many great responses, we somehow managed to whittle the list",|
running shoes on runner... It's marathon season here in the Big Apple and running fever is spreading like wildfire. You may not be a serious runner and have no plan to participate in the 26.2-mile jaunt; but it's still important to understand how to properly prep and train your body,|
"The following is an excerpt from Ed Stafford's book ""Walking The Amazon,"" now available for Kindle, which chronicles his record-breaking hike. On the eighth and last day of rationing we ate all our farine at breakfast knowing that we needed to walk twelve-kilometers to reach Maruá. The jungle had become",|
"Bragging about your hunting prowess is nothing new, but bragging about your prepubescent daughter and her guns seems to be a more recent trend (this Buzzfeed item notwithstanding). A Twitter outpouring of Second Amendment love began after Paul Ryan made a widely publicized stop at a Bass Pro Shops in",|
"If you spend as much time on Facebook as I do, you've noticed a recent influx of proud moms posting kid pictures and updates about the new school year. While so much is brand new with the kiddos, I can't help but notice some patterns emerging with the moms. Here",|
"""You either know fashion or you don't,"" according to Vogue Editor-in-Chief Anna Wintour. I, alternatively, would like to think fashion and I are neither friends nor foes -- more along the lines of acquaintances that run in the same circles... like Facebook friends who may or may not wish each",|
"As soon as the air turns crisp, we can hardly wait to pull on a sweater and celebrate the new season at an outdoor festival. The country's biggest Oktoberfest and the 48th annual National Apple Harvest Festival were shoo-ins for this roundup of 10 fall festivals. But we also tracked",|
"FILE - This Feb. 6, 2009 file photo shows Andy Williams arriving at the MusiCares Person of the Year tribute in Los Angeles. Williams, who had a string of gold albums and hosted several variety shows and specials such as, ""The Andy Williams Show,"" died Tuesday, Sept. 25, 2012, at",|
"Confessions of love and affection on Twitter are an easy way to tell the world all about your significant other (we're looking at you, Aaron Paul and Lauren Parsekian). But even in the digital age, there are some who want to keep ""old fashioned"" traditions alive -- though they're spreading",|
"Yesterday, we gave you some recipes to satisfy your bacon-tooth before next year's ""unavoidable pork shortage."" We're trying not to get too riled up over here, but when the aporkalypse exploded on Twitter, you guys gave us so many ideas to work with. We've put together some coping tools for",|
"Since adults spend roughly eight hours a day (or more) staring at a computer screen, why not take the time between browsing Facebook and checking out our site to save yourself some money on the things you love? Whether it’s home decor, cleaning agents or crafting supplies, getting free shipping",|
"No time to page through thousands of eBay listings? Then just sneak a peek at my weekly eBay roundup of top vintage clothing finds. This eclectic mix of designer and non-designer vintage clothing and accessories caught my discerning eye because of its uniqueness, contemporary feel and highly collectible nature. As",|
"By Caroline Knorr, Common Sense Media editor In many homes, getting kids to turn off their cell phones, shut down the video games or log off of Facebook can incite a revolt. And if your kids say they need to be online for schoolwork, you may not know when the",|
"The Apple iPhone 4s, left, is displayed next to the Samsung Galaxy S III at a store in San Francisco, Monday, Aug. 27, 2012. Apple Inc. on Monday submitted a list of eight Samsung Electronics Co. products it wants pulled from shelves and banned from the U.S. market. Apple submitted",|
"NEW YORK - JANUARY 15: A man uses an ATM in a Citibank branch January 15, 2008 in New York City. Citigroup posted a $9.83 billion loss related to subprime lending and is expected to layoff up to 4,000 employees. (Photo by Mario Tama/Getty Images) If free checking accounts were",|
"""Your IQ depends on a single gene""; ""Long life is all in the genes""; ""A gene that could explain why the red mist descends""; ""Sleeping is all in the genes""; ""Scientists ID morning person gene""; ""The Twitter gene."" Those are real, published headlines. Up until the last one, I'd forgive",|
"Justin Bieber fans, get excited, but not too excited. A new song from Will.i.am's upcoming ""#willpower"" album featuring the teen pop sensation has leaked on the internet. While Bieber does indeed sing on the track -- ""You and me together/ Forever"" is his only line -- his contribution is minimal,",|
"At the Huffington Post, we spend a lot of time on Twitter. It's the best way to get the news (both fashion and otherwise), as well as get to know your favorite stars. In our world models, magazines and muses are like celebrities. So, we're taking a look at the",|
"If you look under the ""Self-Help"" heading on Amazon, you'll find roughly 5,000 books listed under the sub-head ""Self-Esteem."" The vast majority of these books aim to not only tell you why your self-esteem might be low, but to show you how to get your hands on some more of",|
"New York City, The Big Apple, The City That Never Sleeps. So many monikers for this world-famous metropolis. One of the greatest cities in the world, a hub for business, entertainment and, best of all, food! This island is home to some of the world's best cuisine. Which is why",|
"By Peter Henderson and Poornima Gupta SAN FRANCISCO (Reuters) - Tim Cook is no Steve Jobs when it comes to leading Apple Inc. As the debut of the new iPhone 5 just proved, that may not be a bad thing. The taller, thinner and lighter phone prompted a rush on",|
"Allison Williams arrives to a special screening of The Weinstein Company's ""The Master"", presented by The Peggy Siegal Company, on Tuesday, Sept. 11, 2012 in New York. (Photo by Donald Traill/Invision/AP Images) Allison Williams could be going from ""Girls"" to ""Girls Like Us."" According to Variety, ""Girls Like Us,"" based",|
"We have to talk about your condiment usage. We're concerned about your shepherd's pies, your full English breakfasts, your Welsh rarebits, your bacon sandwiches! America: are you letting these foods go un-brown-sauced? If you've never had HP Sauce -- England's favorite brown sauce -- we must insist that this is",|
"We've all got them, no matter how left or right you lean. They're the Facebook friends who can't post a single status update without making it political, or who seem to share every last bit of oversimplified propaganda they come across. And in this election season, they grate like fingernails",|
"I admit, I've gone a little overboard on the pumpkin flavored desserts lately. I made these Pumpkin Chocolate Chip Cookies, after making the Pumpkin Cake Trifles and then also a Pumpkin Apple Streusel Cake and all while drinking more than a few Pumpkin Spiced Lattes. I guess I was a",|
"This past week, I was tasked with the fabulous job of taking the three Miss Universe titleholders (Miss Universe Leila Lopes, Miss Teen USA Logan West, and Miss USA Olivia Culpo) to fashion shows for New York Fashion Week. We got to meet Ryan Lochte, Venus Williams, and some great",|
"No time to page through thousands of eBay listings? Then just sneak a peek at my weekly eBay roundup of top vintage clothing finds. This eclectic mix of designer and non-designer vintage clothing and accessories caught my discerning eye because of its uniqueness, contemporary feel and highly collectible nature. As",|
"mid-adult businessman in a conversation with the consultant or psychologist By Geoff Williams Sept 19 (Reuters) - Getting unmarried is as time-consuming and detail-oriented as tying the knot in the first place, so if you were the type to hire a wedding planner, it's not a far leap to think",|
